favorite_count,source,text,in_reply_to_screen_name,is_retweet,created_at,retweet_count,id_str
899,Twitter for iPhone,"Crônica: MAL ESTAR, de Denis Lerrer Rosenfield que é professor de Filosofia na Universidade Federal do Rio Grande do Sul, publicada no O Globo. https://t.co/A1xxMp8yQE",,False,Mon Dec 25 17:23:52 +0000 2017,200,945344356000714758
4631,Twitter for iPhone,"O NOVO MOVIMENTO DOS CANALHAS: É boçal ver o desespero indutivo da mídia com Lulla não disputando as eleições. Torcem como se todos migrassem para o também investigado por corrupção, Alckmim, ou descesse um Anjo do Céu como novo querido do Sistema corrupto, derrotando Bolsonaro.",,False,Sun Dec 24 13:10:32 +0000 2017,901,944918212285751296
518,Twitter for iPhone,BOLSONARO EM ENTREVISTA À TV BARRETOS. https://t.co/Kp3NbmqbLc,,False,Wed Aug 30 21:01:30 +0000 2017,79,902999745664245760
3673,Twitter for iPhone,Moradores de Itambé e Pedras de Fogo na Paraíba. Acreditemos no Brasil. Um abraço Nordeste. https://t.co/ZiID7FmQw5,,False,Fri Dec 29 22:18:21 +0000 2017,780,946868016180006918
985,Twitter for iPhone,"Sen.Ana Amélia, em Manaus, fala do nióbio. C/o abandono dos últimos presidentes, podemos dizer q a Amazônia é nossa? https://t.co/JtgweYiFlr",,False,Sun Aug 20 01:25:59 +0000 2017,199,899080038624235520
9444,Twitter for iPhone,Não se faz democracia comprando votos e aceitando a corrupção por governabilidade. Reagir a isso é obrigação de qualquer civil ou MILITAR.,,False,Mon Sep 18 13:58:25 +0000 2017,2289,909778642082914304
22,Twitter for iPhone,"@MuhaisenSamara @justinbieber @iansomerhalder @daniel_sharman @RachelSherazade parabéns Samara! Um grande abraço, JB!",usaeua2018,False,Sat Mar 18 23:56:39 +0000 2017,5,843249824778600449
3145,Twitter for iPhone,? https://t.co/Me7hUDODtG,,False,Mon Dec 11 01:06:08 +0000 2017,749,940024871253397504
903,Twitter for iPhone,Jair e @BolsonaroSP recebem venezuelanos que clamam por socorro contra a ditadura de Maduro. https://t.co/cuEj88Kmk9,,False,Wed Aug 23 21:23:56 +0000 2017,240,900468674720616448
5441,Twitter for iPhone,Mto obrigado por todo tipo de consideração q temos recebido em todas as partes e de todos os jeitos no Brasil! Nós acreditamos no futuro 🇧🇷! https://t.co/2k48j1PEKt,,False,Sat Sep 09 01:40:14 +0000 2017,961,906331380816248834
5539,Twitter for iPhone,ELEIÇÕES PRESIDENCIAIS 2018: Pesquisa realizada APENAS no Estado do Rio de Janeiro. https://t.co/u5WDNBnB5J,,False,Wed Jul 12 13:28:40 +0000 2017,1520,885128777516412928
1820,Twitter for iPhone,"Recebendo estudantes de todo Brasil em meu gabinete. Espalhar a verdade pelo Brasil, mesmo que isso não agrade a muitos! https://t.co/TuCf3cRiNi",,False,Tue Jun 27 21:10:31 +0000 2017,391,879809190117728257
1203,Twitter for iPhone,3º COLÉGIO MILITAR DA PM DO AM / CONVITE. EXEMPLO DE ENSINO QUE DEVERIA SER ADOTADO NAS ESCOLAS PÚBLICAS DO BRASIL. https://t.co/mBUvPjNkcL,,False,Sat Aug 05 01:10:12 +0000 2017,270,893640244981059584
829,Twitter for iPhone,"Sen. Humberto Costa, PT/PE, acusa Bolsonaro do que eles são. O Art. 53 (imunidade parlamentar) só serve p/ eles. https://t.co/iGEnuKZxE7",,False,Wed Oct 04 23:39:54 +0000 2017,174,915723180018470912
325,Twitter for iPhone,"@lobaoeletrico Outro, Lobão. E boa sorte na guerra!",lobaoeletrico,False,Sun Nov 12 14:06:33 +0000 2017,22,929712019078549504
779,Twitter for iPhone,Aconselho 👍🏻! https://t.co/15hzW7AUIQ,,False,Mon Aug 21 20:55:47 +0000 2017,143,899736813136248832
2724,Twitter for iPhone,Desfazer rótulos e estabelecer a verdade contra os que querem a continuidade do sistema. Pequena fonte de pesquisa sobre nosso trabalho! https://t.co/2HHwhcP9us,,False,Thu Nov 02 13:18:50 +0000 2017,889,926076133317079041
1046,Twitter for iPhone,A AMIZADE E O TERRORISMO VEM DE BERÇO E ALGUNS DIZEM QUE EXPOR A ESQUERDA É DESNECESSÁRIO! https://t.co/Z2qsfn014m,,False,Thu Nov 02 17:57:22 +0000 2017,203,926146226722168832
888,Twitter for iPhone,"Alguma semelhança c/ algum fato já ocorrido? Como pode td ter duas realidades quando interessa aos desinformantes, mesmo quando td filmado! https://t.co/46zGt5nzHw",,False,Thu Apr 27 08:54:57 +0000 2017,308,857518417171165185
1777,Twitter for iPhone,"Uma entrevista sem edições. Grato @o_antagonista , pelo compromisso com a verdade. É longa, mas vale assistir. https://t.co/8XLNISpZ8X",,False,Sun Oct 22 18:41:29 +0000 2017,457,922171065799008257
1372,Twitter for iPhone,"O PT usa minorias pelo seu projeto de poder. Para nós, quanto menos Estado, mais liberdade e progresso. https://t.co/u8VqLsjx4P",,False,Mon Jun 05 18:41:52 +0000 2017,389,871799247166951424
4260,Twitter for iPhone,"Temos que ter um Ministro da Defesa, um Oficial-General preocupado com sua tropa e com os interesses dos cidadãos de bem de seu país, sem a afeição exclusiva com representação política partidária como acontece há tempos no Brasil. https://t.co/fkfNNIYQfC",,False,Sat Dec 09 19:43:43 +0000 2017,1126,939581342043590656
5097,Twitter for iPhone,"As vezes sentimos não ter noção da confiança que nos é depositada! Claro que sabemos, mas é sempre emocionante, uma responsabilidade e grande honra! Muito obrigado, Cruz Alta - RS. https://t.co/dokSkK3FeQ",,False,Sun Nov 12 23:44:03 +0000 2017,1020,929857351481511936
4942,Twitter for iPhone,"Parabéns Sebastian Piñera pela vitória nas eleições! Desejo um excelente governo, e que o Chile continue sendo muitas vezes exemplo e referência política e econômica para o Brasil.",,False,Mon Dec 18 00:08:13 +0000 2017,837,942547007847190529
2731,Twitter for iPhone,"Hoje estive na Associação Comercial e Industrial da Barra da Tijuca onde conversamos sobre segurança, economia e política! 🇧🇷➡️",,False,Mon Aug 28 19:30:24 +0000 2017,243,902252040818233345
2176,Twitter for iPhone,"PARABÉNS ÀS MULHERES! ""Conhecereis a verdade e a verdade vos libertará!"" Bom Dia a todos! https://t.co/wBDFGurUhJ",,False,Wed Mar 08 10:15:00 +0000 2017,556,839419171331010561
1730,Twitter for iPhone,Conversa com catarinenses em Jaraguá do Sul! Com @BolsonaroSP https://t.co/pw8iL9ofZO,,False,Fri May 19 14:27:13 +0000 2017,277,865574567078748161
867,Twitter for iPhone,"Vale refletir, inclusive sobre o feliz dia dos namorados na segunda! https://t.co/qBKII1cSwB",,False,Sat Jun 10 22:52:17 +0000 2017,180,873674207246372864
2799,Twitter for iPhone,"- Aeroporto de São José do Rio Preto.
- Rumo a Barretos. C/ @BolsonaroSP @FlavioBolsonaro e @CarlosBolsonaro https://t.co/8A1UBzuYJR",,False,Sat Aug 26 15:43:52 +0000 2017,677,901470256530698240
1069,Twitter for iPhone,Aguardando a próxima mentira.... https://t.co/1lLMIwbWEo,,False,Wed May 17 20:44:46 +0000 2017,341,864944808271519746
1209,Twitter for iPhone,"- Rir é o melhor remédio.
- Mitadas do BolsoNabo - 16 . https://t.co/dVlfxAEQ00",,False,Fri Aug 04 14:13:01 +0000 2017,187,893474860420222978
2542,Twitter for iPhone,"José Dirceu, o Capetão do PT, trabalha para roubar também nossa liberdade e esperança. Seus alvos: a Direita e o Capitão Jair Bolsonaro. https://t.co/oeU7ix4I9i",,False,Wed Jun 21 14:38:16 +0000 2017,921,877536148394045440
122,Twitter for iPhone,"@josealdojunior , nós é que somos seus fãs. Você inspira milhões a seguirem seus passos. https://t.co/RoAtkuinIv",josealdojunior,False,Wed Apr 12 14:46:21 +0000 2017,57,852171031955595264
5632,Twitter for iPhone,Boa terça-feira a todos! https://t.co/qu1oqD4C43,,False,Tue Jan 31 10:32:55 +0000 2017,2256,826377714592522240
7054,Twitter for iPhone,"A política nunca dividirá as Forças Armadas, porque, para os militares, o Brasil sempre estará acima de tudo.",,False,Sun Sep 24 15:10:35 +0000 2017,1738,911971127341305858
2594,Twitter for iPhone,"Aponte-me uma só grande obra do Sarney para cá... Naquela época tínhamos segurança, saúde, respeito, liberdade... https://t.co/vgfDKQIPiD",,False,Mon Sep 25 10:25:26 +0000 2017,686,912261757787353089
2257,Twitter for iPhone,"BolsoNabo, @cariocadelegado , @aminkhader e Jair Bolsonaro. Teatro Oi Casa Grande/Rio/RJ. Vamos descontrair.... https://t.co/NLfXhOwdCG",,False,Sun Dec 17 14:45:44 +0000 2017,474,942405455304953856
2153,Twitter for iPhone,"THE ECONOMIST, mas uma revista que é prejudicial até em caso de emergência no banheiro! CUIDADO! https://t.co/BH2QaSbSS8",,False,Thu Nov 09 17:48:45 +0000 2017,324,928680773426794496
1163,Twitter for iPhone,"ECONOMIA E SOBERANIA NACIONAL: Bolsonaro, privatizações, minérios, terras agricultáveis e a China. https://t.co/OoZ3GyAi3N",,False,Wed Oct 18 14:43:16 +0000 2017,212,920661564788826113
2381,Twitter for iPhone,Motorista de desembargador poderá usar arma de fogo. Ótimo! Mas por que eles podem e a sociedade não? https://t.co/PqbRRcmVgz,,False,Fri Feb 03 12:26:21 +0000 2017,982,827493426820157440
6794,Twitter for iPhone,"Após 72 anos do fim da Segunda Guerra Mundial, Bolsonaro posta foto ao lado de torpedo incentivando a violência. Fonte: #fakenews https://t.co/mrwBe5WNEP",,False,Sun Oct 15 17:37:32 +0000 2017,1275,919618257451089920
2916,Twitter for iPhone,"""O TSE, ignorando a lei, não deseja implementar o VOTO IMPRESSO para 2018""... https://t.co/NsbIfmeMuQ",,False,Thu Sep 28 02:38:08 +0000 2017,1156,913231321476026368
30,Twitter for iPhone,@6Lucasm @carteiroreaca ????😂😂😂,6Lucasm,False,Wed Oct 25 22:58:10 +0000 2017,2,923322822847590400
1925,Twitter for iPhone,Reflita sem interferência dos globalistas da ONU: https://t.co/VBJCGldv5V,,False,Tue Feb 14 10:18:42 +0000 2017,812,831447566461988864
710,Twitter for iPhone,Agora - Direto Nova York (vídeo conferência com @OdeCarvalho ) e presença física de brasileiros e americanos! https://t.co/dAq8eVQriv,,False,Sat Oct 14 19:32:40 +0000 2017,131,919284844181512192
3847,Twitter for iPhone,Despejando amor gratuito 💙💙💙... @odiodobem https://t.co/5UCDWTIVG8,,False,Sat Oct 21 12:55:02 +0000 2017,980,921721489929506818
1535,Twitter for iPhone,Segue link de fontes de pesquisas para maiores informações sobre nosso trabalho e pensamentos: https://t.co/qxOc5s5cT2,,False,Sat Dec 16 09:34:57 +0000 2017,390,941964859100614657
4656,Twitter for iPhone,UFC - @BorrachinhaMMA acaba de vencer mais um combate em Fortaleza. Muito obrigado pelo apoio e consideração. https://t.co/kokWVj0akN,,False,Sun Mar 12 00:50:48 +0000 2017,1671,840726734056116224
1390,Twitter for iPhone,"Jair Bolsonaro: ""Em 2015 foi Israel. Agora será a Coréia do Sul."" https://t.co/JrjRCZzhfM",,False,Sun Feb 05 14:31:23 +0000 2017,256,828249665355251712
1343,Twitter for iPhone,"Jandira Beirute e Maria do Sedex, as ""comunistas"" que ñ dispensam uma boquinha de empresários capitalistas!Reflitam! https://t.co/GOuQUtbugs",,False,Fri Apr 07 22:14:30 +0000 2017,535,850471872420564996
1302,Twitter for iPhone,Felipe Moura Brasil (@BlogDoPim ) e a enorme distância entre Bolsonaro e Lula na Economia. https://t.co/s7HuXHPogc,,False,Tue Oct 10 16:44:27 +0000 2017,301,917792957406859264
1597,Twitter for iPhone,"Sobre as urnas eletrônicos dos ""amigos do Foro de SP"": https://t.co/FMWxSjwViW",,False,Wed Aug 02 14:04:59 +0000 2017,602,892748065530163201
1501,Twitter for iPhone,É muito amor da oposição! https://t.co/oIHFQHmWsG,,False,Sun Apr 02 19:27:19 +0000 2017,433,848617863095209986
12527,Twitter for iPhone,"O ex-motorista do terrorista Mariguella, senador do PSDB, citado na Lava Jato e Ministro de Temer disse que minhas ideias não enchem uma xícara. Ele deve se sentir superior porque as dele transbordam um vaso sanitário!",,False,Tue Dec 05 17:13:28 +0000 2017,3162,938093980692156417
703,Twitter for iPhone,Entrevista à TV RTP (Rádio e Televisão de Portugal). https://t.co/Jq4lilHt3O,,False,Mon Dec 18 20:38:52 +0000 2017,139,942856715229331456
1485,Twitter for iPhone,"A intolerância dos ""pregadores do amor!"" Que o documentário sobre as verdades de @OdeCarvalho ganhe mais força com isso! https://t.co/kx174iqmcw",,False,Sat Oct 21 09:05:37 +0000 2017,335,921663756907765760
4160,Twitter for iPhone,"- 07/setembro/2017.
- Brasil acima de tudo!
- Deus acima de todos!
- Cap R/1 - Jair Bolsonaro. https://t.co/8FLHZEVw9W",,False,Thu Sep 07 17:56:17 +0000 2017,842,905852237129318401
5372,Twitter for iPhone,Ela apagou mas temos o print! https://t.co/F3TOmzlmFk,,False,Mon Jun 05 23:04:04 +0000 2017,1521,871865232255328257
783,Twitter for iPhone,"Flávio Dino-PCdoB, parceiro do Presidente do PSC nas eleições de 2016 e tb na Lava-jato, fala sobre Bolsonaro/2018. https://t.co/7mBQ9Nhfee",,False,Mon Apr 17 08:40:21 +0000 2017,160,853890863826706433
2511,Twitter for iPhone,"DOUTRINADOS NO BRASIL 💙 CORÉIA DO NORTE! É muito amor! ""Bolsonaro ditador""! Temos que mudar os rumos da educação no Brasil via MEC! https://t.co/jaepWjj6ll",,False,Fri Oct 13 11:32:23 +0000 2017,508,918801585886687233
3704,Twitter for iPhone,SIMPLES: Somos o oposto ideológico do PT e de Lula! https://t.co/ghX6sXLrAw,,False,Mon Jun 12 12:56:38 +0000 2017,1123,874249080360374272
3158,Twitter for iPhone,Quando souberam que gravaria entrevista 2 jornais desistiram de me ouvir nessa semana. Será pq? 🤔,,False,Mon Mar 06 10:06:01 +0000 2017,645,838692134043668480
3390,Twitter for iPhone,"Depois do Neto, agora é Casagrande (comentarista da Globo), quem critica jogadores que apoiam Jair Bolsonaro. Veja o q ele diz: https://t.co/sW46f9JwL8",,False,Sat May 13 22:14:33 +0000 2017,1236,863517848571965440
2267,Twitter for iPhone,Pequeno Trecho do seriado #BrasilParalelo - O Foro de São Paulo e o esquema de Poder do Sistema. Assistam: https://t.co/KEVe2wHqRg,,False,Sat Oct 21 21:21:52 +0000 2017,813,921849037757796359
1847,Twitter for iPhone,A que ponto chegamos! https://t.co/2qwK4jC97M,,False,Wed Oct 11 12:43:17 +0000 2017,425,918094654393999360
761,Twitter for iPhone,Entrevista completa de @DatenaOficial com @jairbolsonaro . https://t.co/PMfBMdmzzM,,False,Wed Dec 06 15:21:23 +0000 2017,179,938428163499200517
3759,Twitter for iPhone,"Curto desabafo entre amigos! Chega de mimimi... Não gostou?.... tá, ok?! https://t.co/ygBRkDzNty",,False,Mon Jul 24 19:38:00 +0000 2017,995,889570379534151682
1606,Twitter for iPhone,"IV Seminário ""A voz do Campo."" Gramado/RS - Sempre ao lado de quem produz. Brasil acima de tudo! Deus acima de todos! https://t.co/mVOMYbO4Tk",,False,Wed Jul 26 22:17:57 +0000 2017,340,890335406725754888
1608,Twitter for iPhone,"O maior evento MMA da Am. Latina vs politicamente correto. Lona das lutas terá o dizer “é melhor Jair se acostumando”. Oss, @Brigadeiromma ! https://t.co/zyZiVa7nAd",,False,Thu Oct 26 23:23:57 +0000 2017,352,923691700387708929
1408,Twitter for iPhone,"Música ""É melhor JAIR se acostumando"". Obrigado Jairo Cardoso Bolívia. https://t.co/EJiNnBNHCH",,False,Fri Sep 22 10:50:38 +0000 2017,246,911180934103396352
12837,Twitter for iPhone,PRISÃO DO LULA E MINHA CONTINÊNCIA AO JUIZ SÉRGIO MORO. https://t.co/8ieSbcKVe4,,False,Wed Jul 12 19:31:00 +0000 2017,4556,885219962192891906
636,Twitter for iPhone,COMO COMEÇA UM BOM PLANO DE SEGURANÇA. https://t.co/PJ3gHdhn70,,False,Fri Mar 17 14:32:34 +0000 2017,125,842745478815121408
604,Twitter for iPhone,"Contra os que ficam em cima do muro, a verdade! https://t.co/2YL1D8r7RG",,False,Thu Aug 31 12:56:49 +0000 2017,95,903240157226250241
571,Twitter for iPhone,"VIOLÊNCIA SEM LIMITES. Direitos Humanos, desencarceramento e Audiência de Custódia, isso tem que mudar. https://t.co/3lAPgD3zoe",,False,Tue May 09 17:06:21 +0000 2017,162,861990739466743808
2651,Twitter for iPhone,Fatos ocorridos diariamente na Linha Vermelha no Rio de Janeiro é produto de: https://t.co/OufEqFWuHK,,False,Mon Jul 17 10:59:35 +0000 2017,893,886903198656729090
3696,Twitter for iPhone,"""DEBATE DEMOCRÁTICO MOVIDO A AGRESSÕES FÍSICAS!"" É muito amor! Não conseguiram manchar minha excelente passagem pelos EUA! 🇧🇷🇺🇸! https://t.co/bfojG5D9OI",,False,Sat Oct 14 09:02:46 +0000 2017,959,919126321019740161
2397,Twitter for iPhone,"Imagine se fosse um tal de Bolsonaro falando algo somente perto disso? OAB, ONU, MOVIMENTOS SOCIAIS, PIÇÓU, JORNAL NACIONAL.... https://t.co/BWlgVldxXK",,False,Fri Jun 02 10:52:24 +0000 2017,1063,870593939597930496
3761,Twitter for iPhone,ELEIÇÕES 2018: https://t.co/4eHYjd6bXb,,False,Sat Jul 29 10:53:52 +0000 2017,638,891250417069416449
1114,Twitter for iPhone,"""Mini aula"" de @OdeCarvalho , organizada por @BlogDoPim . Seria bacana p/ todo brasileiro assistir este curto vídeo. https://t.co/eJjvazWN9e",,False,Wed May 10 10:22:05 +0000 2017,370,862251387912105984
1007,Twitter for iPhone,"E experimentem nivelar ""Direita"" e esquerda e verão o resultado! Aliás, acho que já viram! Pelo menos ao jogo da imprensa! https://t.co/sujpijRIG5",,False,Sat Aug 05 10:27:29 +0000 2017,184,893780493145174016
7191,Twitter for iPhone,"O @luucaaao apagou seu twitter em que destilava amor, mas temos aqui o print! 😍😍😍 https://t.co/wlWGMyjVr0",,False,Mon Sep 04 01:10:06 +0000 2017,1997,904511856668270592
6064,Twitter for iPhone,"Você não vê, qualquer um desses que me acusam de ser contra a democracia se posicionarem contra controle de mídia e internet. Canalhas!",,False,Tue Oct 17 13:39:05 +0000 2017,1211,920283024146788352
978,Twitter for iPhone,#choramais https://t.co/lWEQbFrSRg,,False,Tue Nov 14 20:40:29 +0000 2017,151,930535932255719424
1033,Twitter for iPhone,🤔 https://t.co/xJlJNeh4Si,,False,Mon Aug 14 21:00:20 +0000 2017,235,897201246360276996
3832,Twitter for iPhone,"O flagrante de agressão ao Deputado Jair Bolsonaro, por militante filiada ao PCdoB. https://t.co/84AQJLSawv",,False,Thu Aug 17 21:49:22 +0000 2017,1044,898300746172690434
1687,Twitter for iPhone,DIA 14 e 15 DE DEZEMBRO - JAIR BOLSONARO EM MANAUS E MANACAPURU - AM. https://t.co/bVWsPmJTgn,,False,Thu Dec 14 01:17:05 +0000 2017,370,941114787668381696
809,Twitter for iPhone,"NA COMISSÃO DE RELAÇÕES EXTERIORES BOLSONARO DIZ VERDADES SOBRE A VENEZUELA PARA EMBAIXADOR ""QUE NADA SABE"": https://t.co/vgqbbPZuB9",,False,Fri Sep 01 20:08:31 +0000 2017,164,903711184628707328
4120,Twitter for iPhone,Revista @VEJA sendo revista Veja: Eles querem o queridinho Lata-Velha Reformada do sistema! O medo deles tem nome e não é o corrupto! https://t.co/RUWitPoB5b,,False,Fri Nov 03 00:25:35 +0000 2017,908,926243927174283264
80,Twitter for iPhone,"@rudylanducci passa-se por Bolsonaro e pega @AgnaldoTimoteo_ em trote. Grato pela simpatia, respeito e consideração. https://t.co/1oh4Tnq4Vd",rudylanducci,False,Fri Jan 27 15:00:17 +0000 2017,12,824995448255569920
2821,Twitter for iPhone,"Saudades eternas do meu velho! Aproveitem a presença dos pais de vocês! Um grande abraço, JB! https://t.co/S4pbbCTDrY",,False,Sun Aug 13 20:01:24 +0000 2017,282,896824027112669185
1119,Twitter for iPhone,Valeu por mais esta homenagem! 👏👍🏻 https://t.co/JBvZkLEdo4,,False,Mon Aug 14 00:28:01 +0000 2017,159,896891121846034432
746,Twitter for iPhone,Professora Dayane Pimentel : a esquerda Brasileira e o Nazismo. https://t.co/spP0IN0RLm,,False,Wed Mar 22 15:43:43 +0000 2017,179,844575324616769538
1393,Twitter for iPhone,A dupla Pepê e Neném falam de Jair Bolsonaro. https://t.co/aFtHSh8Su8,,False,Mon Jul 31 00:14:02 +0000 2017,269,891814170886361089
2216,Twitter for iPhone,- @jairbolsonaro @BolsonaroSP @FlavioBolsonaro e @CarlosBolsonaro em reunião com o mercado financeiro em Boston - EUA (10/10/2017).,,False,Tue Oct 10 13:54:05 +0000 2017,290,917750082778419202
2278,Twitter for iPhone,Agradecemos a lembrança do Comando de Operações Especiais da Polícia Militar do RJ. Com @CarlosBolsonaro https://t.co/ySqxLsb2dF,,False,Wed Sep 27 20:06:33 +0000 2017,249,913132777033338880
1136,Twitter for iPhone,"Jair Bolsonaro em Volta Redonda-RJ.  Hoje, 21/ago, 18hs no Cine 9 de Abril. Palestra: o futuro do Brasil.",,False,Mon Aug 21 14:31:16 +0000 2017,159,899640049217785861
1098,Twitter for iPhone,Opa! https://t.co/iLkpSL7LYE,,False,Fri May 19 10:28:34 +0000 2017,232,865514510185934849
962,Twitter for iPhone,Jair Bolsonaro chega a Campina Grande- PB. ANTV foi conversar com ele. https://t.co/uN30fUnCVL,,False,Thu Feb 09 02:54:33 +0000 2017,184,829523856847204352
7433,Twitter for iPhone,"O STF decidiu manter o Mais Médicos. Na prática, isso representa mais de 1,3 bilhão do nosso dinheiro para a ditadura cubana para manter agentes sem  comprovação de capacidade e aptidão em nosso país, enquanto nossos médicos estão abandonados e sem condições para trabalharem.",,False,Fri Dec 01 12:47:45 +0000 2017,2335,936577560909148160
3299,Twitter for iPhone,- Obrigado Manacapuru/AM. https://t.co/lrxEcEXd0V,,False,Fri Sep 08 02:40:11 +0000 2017,554,905984077337174017
906,Twitter for iPhone,Há algo familiar no Brasil e na França? Vale reflexão! https://t.co/prsV0UNKk1,,False,Wed Mar 15 17:37:51 +0000 2017,238,842067330154803205
19111,Twitter for iPhone,"Defendo o direito à arma pro cidadão de bem e fuzil para o homem do campo se defender do terrorismo. Sou contra o governo controlar mídia e internet. Nem eu nem meus filhos estão envolvidos em corrupção. A diferença entre eu e Lula, antes mesmo da ideologia, está no caráter!",,False,Tue Nov 21 13:05:46 +0000 2017,5347,932958215645618176
5093,Twitter for iPhone,"Aos comunistinhas e derivações, deixo aqui meu extremo sinal de preocupação com vocês: 😂",,False,Tue Feb 21 13:49:27 +0000 2017,1523,834037318503821312
14805,Twitter for iPhone,Reparem que após a agressão fui chamado de tudo menos de corrupto! Estamos no caminho certo!,,False,Thu Aug 17 21:58:04 +0000 2017,4214,898302938031898624
1634,Twitter for iPhone,"- Seremos, no Brasil, inquilinos da China? https://t.co/1RtPf10gfo",,False,Thu Aug 31 20:44:12 +0000 2017,394,903357779573964808
468,Twitter for iPhone,"Ao amigo Silas Oliveira, minha gratidão pela homenagem. Canal do Youtube: https://t.co/njBsZgssnr",,False,Fri Jul 07 09:15:30 +0000 2017,49,883253126622523397
7535,Twitter for iPhone,Falaram que saiu no Financial Times que comparado a mim Trump é um sujeito gentil. Agradeço o elogio!,,False,Wed Aug 30 21:46:50 +0000 2017,1245,903011154045407232
955,Twitter for iPhone,BLOG FAMÍLIA BOLSONARO: PEQUENO RESUMO DE NOSSA LUTA EM PROL DA SEGURANÇA PÚBLICA. https://t.co/yVqbVumTIv (Com @CarlosBolsonaro @FlavioBolsonaro @BolsonaroSP ),,False,Thu Nov 09 13:09:42 +0000 2017,188,928610549507805184
2868,Twitter for iPhone,"Aos q se preocupam c/ meu bem estar, obrigado pelo alerta! A ameaça tornar-se-á concreta somente após ñ conseguirem me derrubar c/ calúnias!",,False,Mon Aug 14 12:00:40 +0000 2017,398,897065433685258241
3088,Twitter for iPhone,"Fernanda Torres ñ consegue emplacar seu ponto de vista. Artistas, q no passado idolatravam Lula, hj atacam Bolsonaro. https://t.co/JqVL9W5TBA",,False,Sat May 06 09:31:51 +0000 2017,1002,860789195803111425
1296,Twitter for iPhone,"Juventude de Teresina/PI paga 10 para o Brasil. Acredito na juventude, acredito no futuro de nossa Pátria. https://t.co/kUEOViNk6l",,False,Tue May 09 15:14:21 +0000 2017,271,861962550216404992
107,Twitter for iPhone,@3455de10cd344c6 Vamos reestabelecer a Ordem e o Progresso como escrito na bandeira Brasileira.,adrianoafroes,False,Sat Dec 09 10:06:24 +0000 2017,15,939436055643779072
578,Twitter for iPhone,"BOLSONARO EM VISITA A ISRAEL: o que seu ""professor"" não conta. https://t.co/G8zBgOQqgp",,False,Mon Aug 21 23:31:26 +0000 2017,101,899775982977957889
1477,Twitter for iPhone,“Fracasso da viagem de Bolsonaro aos EUA”. É uma chamada na Folha de SP. Só rindo deste tipo de militonto. https://t.co/h7UaGWr49x https://t.co/DU2cIvu4ga,,False,Tue Oct 24 20:36:34 +0000 2017,341,922924800820969473
1528,Twitter for iPhone,Dilma Rousseff ataca Jair Bolsonaro e Lula diz que fará a regulação da mídia. Veja o q falamos sobre: https://t.co/PpCf29qAtN,,False,Sat Aug 12 17:40:12 +0000 2017,415,896426103404994564
2803,Twitter for iPhone,A difamação é a arma q usam p/destruir seu adversário. Denuncie o militante dentro das instituições de ensino: soulivrenaescola@gmail.com https://t.co/uDM02QptHc,,False,Wed May 24 01:30:02 +0000 2017,1120,867190923398172672
911,Twitter for iPhone,Roteiro no Paraná a partir de amanhã! Com @BolsonaroSP https://t.co/uoQPLulBNn,,False,Thu May 25 00:42:53 +0000 2017,172,867541447914000384
1117,Twitter for iPhone,Boa garoto! https://t.co/apyK2yOcKd,,False,Thu Apr 20 00:53:09 +0000 2017,330,854860453117341701
1796,Twitter for iPhone,"Por @o_antagonista EXCLUSIVO: ""A CARTA AOS BRASILEIROS DE BOLSONARO. Mensagem, com a qual espera-se rebater ESPECULAÇÕES a respeito de seu futuro comportamento na área econômica, caso seja eleito presidente. via @BolsonaroSP https://t.co/xaIrFmW1y9",,False,Wed Nov 08 15:12:17 +0000 2017,589,928279009934356480
6482,Twitter for iPhone,Pesquisa realizada no estado do Rio Grande do Sul: https://t.co/WAGulw0Zhw,,False,Tue Sep 05 15:57:28 +0000 2017,1534,905097556446806016
716,Twitter for iPhone,"EM PRIMEIRA DISCUSSÃO, VEREADORES DO RIO APROVAM GUARDA DESARMADA NO COMBATE AO CRIME. O voto de @CarlosBolsonaro : https://t.co/rRcNyxylPN",,False,Tue Jul 04 20:10:44 +0000 2017,210,882330858862120966
1731,Twitter for iPhone,P/ uns legítima defesa virou termo a ser utilizado em Marte! https://t.co/TWoLoyw6Dc,,False,Tue Jun 20 15:08:44 +0000 2017,564,877181427061805056
1063,Twitter for iPhone,"Para facilitar sua pesquisa, tentamos agrupar alguns vídeos sobre nossos posicionamentos de relevância nacional: https://t.co/JVYNpX5PXG",,False,Mon Sep 04 16:28:40 +0000 2017,244,904743023917064194
1889,Twitter for iPhone,DATAFOLHA - ELEIÇÕES PRESIDENCIAIS/2018 (nova): https://t.co/Wd3RBYEXHV,,False,Mon Jun 26 15:17:58 +0000 2017,338,879358077857914880
1596,Twitter for iPhone,"""O futuro do Brasil passa pelo respeito à inocência de nossas crianças."" https://t.co/CMLRcNioRD",,False,Sun Aug 27 18:14:46 +0000 2017,287,901870620987805696
